{
  "$schema": "https://json-schema.org/draft/2020-12/schema",
  "title": "BranchSnapshotEvent",
  "description": "Strict host intent to branch one committed Session lineage into another.\n\nThis event is not itself proof that `through_message_id` was committed or\nbelongs to the source lineage. That proof remains trusted service state.",
  "type": "object",
  "properties": {
    "schema": {
      "$ref": "#/$defs/BranchSnapshotEventSchema"
    },
    "eventId": {
      "$ref": "#/$defs/EventId"
    },
    "sourceSessionId": {
      "$ref": "#/$defs/SessionId"
    },
    "sourceBranchId": {
      "$ref": "#/$defs/BranchId"
    },
    "throughMessageId": {
      "$ref": "#/$defs/MessageId"
    },
    "targetSessionId": {
      "$ref": "#/$defs/SessionId"
    },
    "targetBranchId": {
      "$ref": "#/$defs/BranchId"
    },
    "mode": {
      "$ref": "#/$defs/BranchSnapshotMode"
    },
    "occurredAt": {
      "$ref": "#/$defs/Timestamp"
    }
  },
  "additionalProperties": false,
  "required": [
    "schema",
    "eventId",
    "sourceSessionId",
    "sourceBranchId",
    "throughMessageId",
    "targetSessionId",
    "targetBranchId",
    "mode",
    "occurredAt"
  ],
  "$defs": {
    "BranchSnapshotEventSchema": {
      "description": "Closed schema identifier for a host-declared branch snapshot event.",
      "type": "string",
      "enum": [
        "jiandu.dev/branch-snapshot-event/v1alpha1"
      ]
    },
    "EventId": {
      "type": "string",
      "minLength": 5,
      "maxLength": 128,
      "pattern": "^evt_[A-Za-z0-9_-]+$"
    },
    "SessionId": {
      "type": "string",
      "minLength": 5,
      "maxLength": 128,
      "pattern": "^ses_[A-Za-z0-9_-]+$"
    },
    "BranchId": {
      "type": "string",
      "minLength": 4,
      "maxLength": 128,
      "pattern": "^br_[A-Za-z0-9_-]+$"
    },
    "MessageId": {
      "type": "string",
      "minLength": 5,
      "maxLength": 128,
      "pattern": "^msg_[A-Za-z0-9_-]+$"
    },
    "BranchSnapshotMode": {
      "description": "Closed snapshot behavior for the first lineage contract.",
      "type": "string",
      "enum": [
        "snapshot"
      ]
    },
    "Timestamp": {
      "description": "Canonical RFC 3339 timestamp in UTC using the `Z` designator.",
      "type": "string",
      "format": "date-time",
      "minLength": 20,
      "maxLength": 35,
      "pattern": "^\\d{4}-\\d{2}-\\d{2}T\\d{2}:\\d{2}:\\d{2}(?:\\.\\d{0,8}[1-9])?Z$"
    }
  }
}
