{
  "schema": "jiandu.dev/branch-snapshot-event/v1alpha1",
  "eventId": "evt_01K4SNAPSHOT",
  "sourceSessionId": "ses_01K4SOURCE",
  "sourceBranchId": "br_01K4SOURCE",
  "throughMessageId": "msg_000042",
  "targetSessionId": "ses_01K4TARGET",
  "targetBranchId": "br_01K4TARGET",
  "mode": "snapshot",
  "occurredAt": "2026-08-30T04:17:10Z"
}
